{
  "content_sha256": "40a40c42d09c386ce957c28dc4eeffa78e0bfed9686417068908d630ddacb66e",
  "policies": {
    "catalog_unreachable": "reject",
    "duplicate_row": "reject",
    "missing_row": "reject",
    "out_of_split": "reject",
    "target_mismatch": "reject"
  },
  "prepared_dataset_binding": {
    "content_sha256": "6de5d3cbf4b73896fdd8d186226556d0d552a8f8eef2a9679c8945cb7783b0be",
    "schema_id": "sidscope.prepared_dataset.v1",
    "schema_revision": "1.0.0"
  },
  "producer": {
    "name": "sidinspector.contracts",
    "version": "1.2.0.dev0"
  },
  "rows": [
    {
      "episode_id": "test-b",
      "evaluator_labels": {
        "dormancy_bucket": "fixture"
      },
      "order": 0,
      "split_row_index": 1,
      "target_normalized_item_id": 2
    }
  ],
  "schema": "sidscope.episode_selection.v1",
  "schema_revision": "1.0.0",
  "selection_id": "rpg:explicit-test-b-only",
  "split": {
    "sha256": "31ee0fb320ebcdd583997d2b097788b46a95e257b8eaebe45a80796f7a748cdb",
    "split_id": "synthetic/frozen/test"
  }
}
